text,date,evento,sentiment,score
"RT IVotedBecause I believe in equality, we need comprehensive immigration reform, I am pro choice and global warming IS real. Ã â Â",,,NEU,0.5291
RT Russia hack deniers amp climate change deniers have a lot in common. Either theyre corrupt or they refuse 2 accept univerÃ â Â,,,NEG,0.9061
RT Adults are wasting valuable minutes of their lives trying to figure out if a birther thinks climate change is a hoax.,,,NEG,0.8319
RT she's thinking about how she's going to die because your husband doesn't believe in climate change,,,NEG,0.8725
RT Oil company executives are far more likely to believe in man made climate change than Republican politicians.,,,NEG,0.5009
RT The IPCC is a governmental organization whose sole purpose from day one was to push global warming propaganda.,,,NEG,0.7541
RT Americans who'll suffer the most economically from climate change are among the likeliest to deny it exists or that,,,NEG,0.6314
"100 in the bay in September, amp 2nd hurricane heading for US Mainland, but climate change is fake right... okay, alright",,,NEG,0.5677
"RT its 94 degrees outside right now, in november, but we just elected a president who doesnt believe in climate change Ã Å ï Â Ã Ëœâ Ã Â ï",,,NEG,0.8361
"TrumpProtest TRump doesnt believe in climate change...WTF how will we breathe or drink water or SURVIVE if our air, water, land is dirty?!",,,NEG,0.9226
RT Good morning to everyone except climate change deniers,,,NEU,0.549
RT We have a president elect who doesn't believe in climate change. Millions of people are going to have to say Mr. TÃ â Â,,,NEG,0.8839
Dangerous times when a world leader has called climate change a hoax.,,,NEG,0.9094
RT If global warming is a hoax then why did club penguin shut down,,,NEG,0.7975
RT EPA flooded with phone calls after EPA head denies CO2 role in climate change report,,,NEU,0.6291
RT Trump meets with Princeton scientist who called 'global warming' fears 'pure belief disguised as science',,,NEU,0.6007
RT A climate change denier who calls progressives 'race traitors' as chief agricultural scientist ? Sure why not.,,,NEG,0.7528
RT Eastern Australia bakes in heatwave Keep denying climate change and the LNP will destroy us,,,NEG,0.8469
RT Some millennials actually believe that they are going to die young because of climate change. How stupid is that?Ã â Â,,,NEG,0.9258
"RT Denying climate change insults those who suffer its consequences, as in Peru",,,NEG,0.8375
RT MYTH you have to be a certain type of person to care about climate change. viÃ â Â,,,NEU,0.4983
RT she's thinking about how she's going to die because your husband doesn't believe in climate change,,,NEG,0.8725
"RT Welcome to America. Where we deny climate change, men brag about rape, and the KKK supports our president. notmypresident",,,NEG,0.8948
"RT If you donÃ â â t believe man made global warming is a a silly issue, give to the Natural Resources Defense Council",,,NEG,0.5932
RT This is now the liberal version of the right's climate change denial,,,NEG,0.6164
RT HRC proposes installing half a billion solar panels by the end of her first term. Trump thinks climate change is a hoaxÃ â Â,,,NEU,0.6152
"...and all climate change deniers, no doubt! HELP!!!!",,,NEG,0.8088
RT It doesn't matter to the ocean if you 'believe' in climate change it's just going to rise. standupforscience,,,NEU,0.6304
"I relate to how angry is at non voters, climate change deniers and shit.",,,NEG,0.8079
RT Worth reading Merchants of Doubt. Same who tried to deny smoking deaths r denying climate change,,,NEU,0.629
RT Donald Trump has called climate change 'a hoax.' Here's what could happen if he rolls back anti pollution measures,,,NEG,0.653
RT she's thinking about how she's going to die because your husband doesn't believe in climate change,,,NEG,0.8725
global warming is the biggest crock of shit ever uttered a scam for control and,,,NEG,0.9014
"RT Shocking that the man who lied about birtherism, climate change, crowd size, his victory margin, amp voter fraud also lied ab",,,NEG,0.8282
RT Evolution amp climate change denial on the right. Anti vaccine amp anti GMO on the left. Scientific ignorance is bipartisan.,,,NEG,0.8284
RT she's thinking about how she's going to die because your husband doesn't believe in climate change,,,NEG,0.8725
"RT . He shoved allies, reversed our leadership on climate change, diminished NATO. Trump embarrassed America",,,NEG,0.9122
RT she's thinking about how she's going to die because your husband doesn't believe in climate change,,,NEG,0.8725
"RT If you don't believe in climate change, you shouldn't head the EPA. It's really that simple.",,,NEG,0.6502
RT she's thinking about how she's going to die because your husband doesn't believe in climate change,,,NEG,0.8725
RT she's thinking about how she's going to die because your husband doesn't believe in climate change,,,NEG,0.8725
"Agreed. However, the overwhelming majority of people believe humans impact global warming...",,,NEU,0.7646
so climate change deniers?,,,NEU,0.5181
"RT Donald trump, the now president of the United States...... does not believe in global warming Ã Å Ëœï",,,NEG,0.6849
RT people who deny climate change,,,NEG,0.6857
RT China tells Trump climate change isn't a hoax it invented,,,NEU,0.6436
It's 54 degrees at 7 am and by 7 pm it's going to be 26... global warming is a myth tho right...,,,NEU,0.5648
RT 8 of Democrats deny climate change is a problem. I suspect there is a lot of overlap bet,,,NEU,0.5445
RT The Whitehouse is being filled with creationist climate change deniers. But on the plus side God will give your grandchilÃ â Â,,,NEG,0.66
RT she's thinking about how she's going to die because your husband doesn't believe in climate change,,,NEG,0.8725
RT if global warming isn't real then explain this,,,NEG,0.6177
New EPA chief denies CO2 is major factor in climate change,,,NEG,0.5214
RT she's thinking about how she's going to die because your husband doesn't believe in climate change,,,NEG,0.8725
I was gonna say I can't believe y'all voted for a dumbass who doesn't believe in climate change but then I remembered who 'y'all' are LOOOL,,,NEG,0.9113
RT We have a president elect who doesn't believe in climate change. Millions of people are going to have to say Mr. TÃ â Â,,,NEG,0.8839
Wearing shorts mid November butttt global warming is just a hoax,,,NEG,0.5013
Scorching hot to raining hell real quick . . . . . global warming is a myth,,,NEG,0.7618
RT them global warming isnt real florida,,,NEG,0.5913
RT We have a president elect who doesn't believe in climate change. Millions of people are going to have to say Mr. TÃ â Â,,,NEG,0.8839
RT We have a president elect who doesn't believe in climate change. Millions of people are going to have to say Mr. T,,,NEG,0.8662
if you don't believe in global warming now then I truly don't know what to tell you,,,NEG,0.7911
We have a president elect that does not believe in climate change. This is dangerous to humanity and our planet.,,,NEG,0.905
RT she's thinking about how she's going to die because your husband doesn't believe in climate change,,,NEG,0.8725
RT We really elected someone who doesn't believe climate change is real,,,NEG,0.8631
RT I take it South Park writers dont believe in global warming LOL,,,NEU,0.6456
RT We have a president elect who doesnÃ â â t believe in climate change. ThatÃ â â s frightening for this country and the world.,,,NEG,0.8961
RT Theresa May's new DUP friends are climate change deniers on the scale of Trump,,,NEG,0.5137
Earlier dystopian futurists discounted severity of global warming Notable exception Mad Max,,,NEU,0.5937
All we talked to couldn't believe 45's position on climate change and coal. Efficiency also big issue.,,,NEG,0.7857
US has EPA Administrator that denies human role in climate change.,,,NEG,0.6262
RT The state that will be most affected by climate change Florida is voting for climate change denier...Ã â Â,,,NEG,0.7585
RT When people try and tell me climate change isn't real,,,NEG,0.5417
"RT Although 97 of Climate Scientists Disagree, EPA head Scott Pruitt denies that carbon dioxide causes global warming ht",,,NEU,0.6415
"RT In case you worried about Trump meeting Al Gore, he just tapped a major manmade climate change denier to head the EPA. Lib",,,NEU,0.686
RT HRC proposes installing half a billion solar panels by the end of her first term. Trump thinks climate change is a hoaxÃ â Â,,,NEU,0.6152
RT climate change deniers aren't in the least interested in facts.,,,NEG,0.7997
"Jane Fonda, Naomi Klein, and Kathleen Wynne think climate change is an urgent crisis. Deniers everywhere say 'I knew I nailed it!'",,,NEU,0.5819
"Most Americans don't believe global warming will affect them, but still want to regulate emissions.",,,NEU,0.6233
RT If you don't believe in global warming then look at WNY's weather this year and explain that shit to me,,,NEG,0.781
"Trump denies climate change, but could one day be its victim",,,NEG,0.7101
RT someone please explain to me how global warming isn't real when it's 66 degrees in F E B R U A R Y!!!!!,,,NEG,0.6049
Incoming GOP assemblyman believes climate change is good because it hurts 'our enemies' music news,,,NEU,0.5884
RT victory for trump could mean the end of the world literally. to have someone who thinks climate change is a hoax in oÃ â Â,,,NEG,0.6782
RT ICYMI The US and China support action on climate change. Trump and Putin support the US not defending NATO allies,,,NEU,0.6142
"When I hear ppl say man is not driving climate change, I think of that football player who doesn't believe in dinos",,,NEG,0.5601
RT HRC proposes installing half a billion solar panels by the end of her first term. Trump thinks climate change is a hoaxÃ â Â,,,NEU,0.6152
RT she's thinking about how she's going to die because your husband doesn't believe in climate change,,,NEG,0.8725
RT We have a president elect who doesn't believe in climate change. Millions of people are going to have to say Mr. TÃ â Â,,,NEG,0.8839
RT EPA flooded with phone calls after EPA head denies CO2 role in climate change report,,,NEU,0.6291
RT We have a president elect who doesn't believe in climate change. Millions of people are going to have to say Mr. TÃ â Â,,,NEG,0.8839
RT It takes a willful disregard for data amp facts to deny scientific consensus on the human influence on climate change. ht,,,NEG,0.7243
RT she's thinking about how she's going to die because your husband doesn't believe in climate change,,,NEG,0.8725
republicans be like 'i don't believe in climate change and here's why' links an article from a denier website with 0 scientific accuracy,,,NEG,0.7677
"RT Trump pretends not to believe in climate change, but he's buying a wall to protect his Ireland golf course from rising seaÃ â Â",,,NEU,0.5974
"i was telling him to prove that climate change is NOT real, because at this point it's obvious it is. t",,,NEG,0.5635
Not a single mention of China inventing climate change. Fake news!!! BBCDebate LeadersDebate,,,NEG,0.8248
"RT The guy who doesn't believe in global warming, just dropped 59 missles in Syria.. God please watch over us when we need y",,,NEG,0.805
"RT On the day PK tells ABC's 730 their standards have dropped, they follow climate change denying racist Hanson for a swim",,,NEG,0.8379
RT There are people who believe in weather reports determined by a ground hog but don't believe in climate change determine,,,NEU,0.6818
RT she's thinking about how she's going to die because your husband doesn't believe in climate change,,,NEG,0.8725
Denying climate change is dangerous. Join the push to the world's future. His essay as WIRED s guest editor,,,NEU,0.4981
Zach doesn't believe in global warming? Lolol okay...,,,NEU,0.7061
"RT Hey Florida, nice little Everglades you've got there. Thanks for voting for a climate change denier. See you in hurricaneÃ â Â",,,NEG,0.8421
97 of scientists believe climate change. Trump supporters GIVE THE 3 A CHANCE. climatemarch climatechange,,,NEU,0.573
RT 'How do you make climate change personal to someone who believes only God can alter the weather?',,,NEU,0.6725
RT Show these terrifyingly alarming photos to anybody who doesn't believe in climate change,,,NEG,0.7864
RT The new head of the EPA doesn't believe in climate change amp is currently suing the EPA. Someone get the fucking rin,,,NEG,0.9206
RT We have a president elect who doesn't believe in climate change. Millions of people are going to have to say Mr. TÃ â Â,,,NEG,0.8839
RT We live in a generation that is more scared of visible panty lines than it is of global warming.,,,NEG,0.8034
i was obviously misled by nasa's ice core global warming scare.,,,NEG,0.8098
since he thinks global warming is a hoax this is literally what Trump's America will look like,,,NEG,0.7919
RT she's thinking about how she's going to die because your husband doesn't believe in climate change,,,NEG,0.8725
RT It's official our EPA administrator doesn't believe in global warming welcome to hell yall,,,NEG,0.8624
RT We have a president elect who doesn't believe in climate change. Millions of people are going to have to say Mr. TÃ â Â,,,NEG,0.8839
Remember global warming is a hoax kids never mind those two pesky giant storms Harvey and Irma prayers,,,NEG,0.7441
RT The Whitehouse is being filled with creationist climate change deniers. But on the plus side God will give your grandchilÃ â Â,,,NEG,0.66
RT We have a president elect who doesn't believe in climate change. Millions of people are going to have to say Mr. TÃ â Â,,,NEG,0.8839
"RT This is a superb assessment of climate change denialism Q amp A, episode 4 Mountain Beltway",,,POS,0.542
RT It's still not clear that Trump believes in climate change. We know the guy running the EPA doesn't either. It is astounding.,,,NEG,0.867
"It's going to be unseasonably cold all week, but climate change is apparently a hoax. Mkay",,,NEG,0.8515
"RT Of course they have, fuck all to do with FAKE climate change, all to do with trade partnerships.",,,NEG,0.8876
RT 'To deny climate change betrays the essential spirit of this nation the practical problem solving which guided our founde,,,NEG,0.5538
RT she's thinking about how she's going to die because your husband doesn't believe in climate change,,,NEG,0.8725
Going to miss him. Doing his best to protect us the best he can from a man who does not believe in climate change.,,,NEU,0.4862
RT America has fucked over the lives of millions amp the future of this earth b c climate change is a hoax made up by the ChinÃ â Â,,,NEG,0.9178
Are you saying he DOESN'T believe in global warming climate change?,,,NEU,0.6467
RT she's thinking about how she's going to die because your husband doesn't believe in climate change,,,NEG,0.8725
RT A pitch to Conservatives who think the party's tradition of climate change denial is too moderate.,,,NEU,0.5011
RT Prince Charles calls climate change the 'wolf at the door'. has called it a 'hoax' and 'bull '.,,,NEG,0.6913
Trump's just named EPA chief is a climate change denier via,,,NEG,0.5825
RT If global warming isn't real how come club penguin is shutting down?,,,NEG,0.766
RT 9. The president elect does not believe climate change is real. He has promised to negate the Paris Climate Agreement,,,NEG,0.8171
RT Trump hired a climate change denier someone who claims climate change is a hoax to lead the EPA! myronebell. UnbelievabÃ â Â,,,NEG,0.8784
RT Thank you climate change is a fake and a way to get money for globalist,,,NEG,0.8287
What scares me most about global warming is the possibility of more nude beaches.,,,NEG,0.8373
RT Trump will be the only world leader to deny climate change.,,,NEU,0.5335
Trump's denial of climate change should be his biggest scandal... Wtf is he thinking. Is making the world better so horrible? climatechange,,,NEG,0.9385
RT Pruitt won't say if Trump believes climate change is real,,,NEU,0.639
"RT Trump denies climate change, but could one day be its victim",,,NEG,0.654
the US won't matter. We'll be run by climate change deniers. Policies will hurt everyone somehow.,,,NEG,0.8778
I made no political assumption just picked outlets that push climate change denial. Your fail.,,,NEG,0.7828
RT Exposed How world leaders were duped into investing billions over manipulated global warming data tcot p2,,,NEG,0.5472
RT We have a president elect who doesn't believe in climate change. Millions of people are going to have to say Mr. TÃ â Â,,,NEG,0.8839
RT she's thinking about how she's going to die because your husband doesn't believe in climate change,,,NEG,0.8725
"RT IVotedBecause I believe in equality, we need comprehensive immigration reform, I am pro choice and global warming IS real. Ã â Â",,,NEU,0.5291
RT The Whitehouse is being filled with creationist climate change deniers. But on the plus side God will give your grandchilÃ â Â,,,NEG,0.66
Sign the pledge to StandUpForScience and against climate change denial and disinformation,,,NEU,0.7329
RT Why you shouldnÃ â â t trust climate change deniers â â s Reality Check,,,NEU,0.5334
RT You won't be calling me a liberal snowflake when the global warming that you claim doesn't exists melts all the snowfl,,,NEG,0.7102
The right in America may deny climate change but conservatives in the UK are taking action,,,NEU,0.7847
RT How can we be surprised there are climate change deniers when 90 of us believe germs count to 5 before jumping on droppedÃ â Â,,,NEG,0.6653
It still amazes me that people don't believe global warming is real,,,NEG,0.8335
"RT Here are 5 random people who say climate change is a hoax. Here are 5,000 scientists who say it s real. See?! Th",,,NEU,0.5557
RT she's thinking about how she's going to die because your husband doesn't believe in climate change,,,NEG,0.8725
RT if global warming doesn't exist then why is club penguin shutting down,,,NEG,0.6146
RT I can't respect a leader who doesn't believe in climate change.. actually I can't respect you period if you don't believeÃ â Â,,,NEG,0.9058
RT she's thinking about how she's going to die because your husband doesn't believe in climate change,,,NEG,0.8725
RT To the ppl who believe climate change is a myth where is the harm in protecting our planet anyway? Why not use cleaner saf,,,NEG,0.6694
"RT I can't believe Trump doesn't believe in climate change. It's not something you 'believe in' it's 110 factual, but",,,NEG,0.7432
"RT Really useful summary of what may lie ahead on climate change. Face it, we weren't addressing the issue the night bÃ â Â",,,NEU,0.4963
"RT March for Science rallies hit Trump for climate change skepticism, budget cuts",,,NEG,0.6417
And owns a condo in a San Fran flood zone guess he doesn't believe in climate change after all,,,NEG,0.7055
"Sessions is an unqualified anti civil rights, climate change denying bigot who should NOT be our AG! stopsessions",,,NEG,0.9323
"RT Simple. I believe in climate change, a woman's right to choose, gun safety amp the wealthy paying their fair share. TÃ â Â",,,NEU,0.6426
RT We have a president elect who doesn't believe in climate change. Millions of people are going to have to say Mr. TÃ â Â,,,NEG,0.8839
RT Country with the 2nd highest greenhouse gas emissions on the planet just elected a climate change denier as president. Ã â Â,,,NEG,0.8675
"RT If we assume global warming is a hoax, what should we expect to see?",,,NEG,0.5673
"Coalition w women hating,homophobic right wing 'Christians', climate change denier is Environment Sec. I feel like I've moved to Trumpton.",,,NEG,0.8814
RT I cannot believe the expects intelligent readers to engage with a columnist who questions global warming. How insultin,,,NEG,0.9199
RT she's thinking about how she's going to die because your husband doesn't believe in climate change,,,NEG,0.8725
Y'all it's the middle of November and I'm wearing a tank top but 'climate change isn't real' OKAY,,,NEU,0.5691
RT she's thinking about how she's going to die because your husband doesn't believe in climate change,,,NEG,0.8725
RT We have a president elect who doesn't believe in climate change. Millions of people are going to have to say Mr. TÃ â Â,,,NEG,0.8839
RT people who complain about how hot it is outside still but deny global warming,,,NEG,0.6523
CAUSE ITS THE TRUTH BYE... Thats why your president doesnt believe in global warming... Cause yall think 90F is nor,,,NEG,0.7213
RT 63 of Aussies believe as a country we should be a world leader in finding solutions to climate change ClimateoftheNat,,,POS,0.5343
RT she's thinking about how she's going to die because your husband doesn't believe in climate change,,,NEG,0.8725
RT the replies to this are why i stopped trying with climate change. humans deserve to suffer for their treatment of t,,,NEG,0.9309
the tactics of creationism and climate change denial.,,,NEG,0.6195
Denying climate change as the seas around them rise CNN The Louisiana coast is,,,NEU,0.6645
RT CNN's Brian Stelter destroyed by Weather Channel founder John Coleman over global warming. It is a hoax.,,,NEG,0.8109
"Euro Times For China, climate change is no hoax it's a business and political opportunity via",,,NEU,0.6671
"RT Trump's new EPA boss denies climate change, loves pesticides",,,NEU,0.6352
"RT Countries hardest hit by drought, and famine, produce almost none of the emissions believed to cause climate change",,,NEU,0.4918
"Americans are willing to believe a sky creep gets angry at intercourse without a piece of metal on one's finger, but not climate change.",,,NEG,0.6652
RT HRC proposes installing half a billion solar panels by the end of her first term. Trump thinks climate change is a hoaxÃ â Â,,,NEU,0.6152
"I'm only thankful, that the Liberal Party has debunked climate change as a myth, otherwise, we'd REALLY be in the sh t wouldn't we!",,,POS,0.4806
RT GOpers deny climate change but for some reason they all accept scientists on the SolarEclipse,,,NEU,0.6601
JP was pissing me off with his whole 'global warming isn't real' bit today. Boiiii sit down Ã Å ËœÂ lol,,,NEG,0.9017
"RT Larry King, 'Everyone can tell there's global warming!' Really? Even believers say its been about 1 degree in 100 years. C",,,NEU,0.6566
RT she's thinking about how she's going to die because your husband doesn't believe in climate change,,,NEG,0.8725
"RT No Scientist denies climate change, climate is changing all the time, whether it be warming or cooling, it always",,,NEU,0.8217
RT she's thinking about how she's going to die because your husband doesn't believe in climate change,,,NEG,0.8725
RT How do we have a president who doesn't believe in global warming now?,,,NEG,0.658
"With all the time spends in Florida, you'd think he'd believe in global warming.",,,NEU,0.6345
RT she's thinking about how she's going to die because your husband doesn't believe in climate change,,,NEG,0.8725
RT Sanders to Zinke 'Is Trump right? Is climate change a hoax?' Zinke 'I don't believe it's a hoax' but not sure how much h,,,NEU,0.6381
RT We have a president elect who doesn't believe in climate change. Millions of people are going to have to say Mr. TÃ â Â,,,NEG,0.8839
RT How a professional climate change denier discovered the lies and decided to fight for science,,,NEG,0.5012
is a great bipartisan org. Im a republican but I believe climate change is REAL!!! climatechange supermoon trump,,,POS,0.9461
RT China tells Trump climate change isn't a hoax it invented,,,NEU,0.6436
RT she's thinking about how she's going to die because your husband doesn't believe in climate change,,,NEG,0.8725
"RT After war and climate change have killed us all, I just hope aliens visit earth and ride our rollercoasters.",,,NEG,0.7263
RT We will be the only developed nation in the world led by a climate change denier.,,,NEG,0.7856
RT she's thinking about how she's going to die because your husband doesn't believe in climate change,,,NEG,0.8725
RT Tell me global warming doesn't exist,,,NEG,0.5425
"Point on fracking is that if we're going to argue with climate change deniers, and we should, it doesn't help if we use words inaccurately.",,,NEG,0.6671
RT Donald Trump has called climate change a hoax. A Chinese official says it is anything but.,,,NEG,0.7707
RT Climate Scientist we're in the midst of mass extinction Oil Tycoon climate change is a myth Journalist these people are eq,,,NEG,0.63
EPA head Scott Pruitt denies that carbon dioxide causes global warming Lunatics running Asylum America auspol,,,NEG,0.7071
RT LNP and climate change denial industry crapping themselves!,,,NEG,0.8807
RT This was an eye opener how to convince climate change deniers to change the way they think about climate change f,,,NEU,0.7079
RT जय ह ट रम प ब ब क ! हद ह हद US Environment head denies that CarbonDioxide causes global warming,,,NEG,0.5069
"She would make a good set with the other human rights, evolution and climate change deniers. Why not have the whole",,,NEU,0.6243
RT Every second we waste denying climate change is stolen from the next generation who will suffer,,,NEG,0.8526
"RT Pence doesn't believe in climate change, evolution or that some ppl are born gay. Can't he just not believe he saw HamiltÃ â Â",,,NEG,0.8189
"RT The right's platform Take away health care, end food stamps, deny climate change, and launch a nuclear arms race.",,,NEG,0.8525
RT Scientists want to give the atmosphere an antacid to relieve climate change,,,NEU,0.8272
Another global warming argument bites the dust No Increase in Global Drought Over Past 30 Yrs ClimateScam PJNet,,,NEG,0.707
"RT I believe in climate change, voted for HRC. I could be spox! Scaramucci believes in climate change, voted for Obama",,,NEU,0.6199
"Perry, made head of DOE, denies climate change driver. American Meteorological Society corrects him HonestQuestion",,,NEU,0.664
RT not buying into that jewish global warming propaganda or whatever,,,NEG,0.6914
