text,date,evento,sentiment,score
RT How can Trump deny climate change despite all the liberal snowflakes melting ? ClimateChangeIn5Words,,,NEU,0.5654
If you and Pruitt don't believe in climate change why you now moving to N.J Instead of FLA?But yo,,,NEG,0.772
RT we are watching them eff up America. 'I deny climate change because it gets in the way of me making MONEY right now wi,,,NEG,0.886
RT China tells Trump climate change isn't a hoax it invented,,,NEU,0.6436
It's both raining and snowing. Spring and winter. But climate change is totally a Chinese conspiracy. thankstrump dearscottpruit,,,NEG,0.8306
RT The head of the EPA doesn't believe in the science behind global warming and I wrote about it for,,,NEG,0.8495
1 2 I'm not a climate change denier. I think we certainly have a subtle impact upon our planets climate. But a greater impact,,,NEU,0.7679
RT Didnt yall vote for someone who believes climate change is fake,,,NEG,0.7087
RT We have a president elect who doesnÃ â â t believe in climate change. ThatÃ â â s frightening for this country and the world.,,,NEG,0.8961
"RT Doug Edmeades Prof. Rowarth's partner in EPA crime is an 'out' climate change denier. Surprise, surprise.",,,NEG,0.7288
RT it's 80 degrees in november and people wanna think global warming isn't real,,,NEG,0.492
RT We have a president elect who doesnÃ â â t believe in climate change. ThatÃ â â s frightening for this country and the world.,,,NEG,0.8961
"RT Dion implies that climate change played role in Middle East violence Stéphane Dion, ...",,,NEU,0.5242
RT We have a president elect who doesn't believe in climate change. Millions of people are going to have to say Mr. TÃ â Â,,,NEG,0.8839
i legit don't understand ppl tht think climate change is a hoax....like are you tht dumb? there's evidence literally everywhere you look lol,,,NEG,0.8996
RT 17 House Republicans are pushing back against climate change denialism,,,NEU,0.8747
Watch President Obama is working and helping fight climate change deniers derail progress in 2016,,,NEU,0.5448
RT No you are wrong as usual. Fringe views like climate change denial or Creationism do not deserve airspace on the,,,NEG,0.8589
"Remember, guys climate change is a myth.",,,NEU,0.5288
RT Folks be saying 'the sky' when you ask them 'what's up' but don't be believing in global warming. Smh staywoke,,,NEG,0.5868
climate change is fake iamright,,,NEG,0.6979
RT HappyBirthdayCarlSagan sorry america elected a president that doesnt believe in global warming,,,NEG,0.8195
Gonna go out on a limb here and assume these science buffs believe that global warming doesn't exist either.,,,NEU,0.6296
RT Lol sexists Lol racists Lol climate change deniers Lol facists Lol homophobes Lol donald trump,,,NEG,0.8071
RT ICantRespectAnyoneWho thinks climate change is a hoax,,,NEG,0.8004
RT Yo it's fucking November and we have no snow on the ground. If you think global warming doesn't exist hmu so I can slap someÃ â Â,,,NEG,0.9185
RT she's thinking about how she's going to die because your husband doesn't believe in climate change,,,NEG,0.8725
RT Coachella's profits fund anti lgbt groups and climate change denial strategy groups but have fun!,,,POS,0.4697
RT I heard is on right now. What a combo. Fake news interviews fake climate change propagandist.,,,NEG,0.8614
RT 'In particular PresidentTrump has to stop the job wrecking political scam of climate change',,,NEU,0.5371
"RT 80 degrees in November Ã Å ËœÅ Ã Å â Å Ã Å Å Â but global warming isn't real, liberals Ã Å â â Ã Å ï Â Ã Å â Å½Ã Å ËœÂ",,,NEU,0.479
RT We have a president elect who doesn't believe in climate change. Millions of people are going to have to say Mr. TÃ â Â,,,NEG,0.8839
RT HRC proposes installing half a billion solar panels by the end of her first term. Trump thinks climate change is a hoaxÃ â Â,,,NEU,0.6152
"C.E.O. of Exxon, climate change denier Rick Perry for head of Dept. of energy. The madness goes on and on.",,,NEG,0.767
"RT Hey global warming deniers, deny this photographic evidence",,,NEG,0.7314
"I know would not believe it because of his global warming theory but yesterday mid 70 , today snow?!",,,NEG,0.7193
RT Now the UN amp other globalists tell America the AGW climate change hoax is unstoppable. Guess we will see about that. htÃ â Â,,,NEG,0.5547
RT she's thinking about how she's going to die because your husband doesn't believe in climate change,,,NEG,0.8725
RT How y'all believe in god but not climate change,,,NEU,0.6451
RT Donald Trump has called climate change a hoax. A Chinese official says it is anything but.,,,NEG,0.7707
RT she's thinking about how she's going to die because your husband doesn't believe in climate change,,,NEG,0.8725
RT The BBC doesn't give time to flat earthers. Why does it give time to Nigel Lawson and other climate change deniers?,,,NEG,0.7306
RT she's thinking about how she's going to die because your husband doesn't believe in climate change,,,NEG,0.8725
"RT He's bringing in climate change deniers, white nationalists, GOP insiders, Wall Street cronies, pero like give him a chanceÃ â Â",,,NEU,0.5303
"RT For those studying climate change, denial and the censoring of the term puts them at war with observable reality.",,,NEG,0.7476
"RT In full page ad in NYT in 2009, called for urgent action on climate change. Which does he believe? httÃ â Â",,,NEU,0.8952
RT The Republican Party is the only major political party in any developed country that denies science amp climate change,,,NEG,0.7932
We must push hard against climate change denial The Capital Times If Trump silenced all,,,NEG,0.4876
Mr Trump has called global warming a Chinese hoax to thwart business. Mrs ClintonÃ â Â,,,NEG,0.5775
RT The people who predicted parts of Manhattan would be underwater by 2008 due to climate change are concerned about 'fakeÃ â Â,,,NEG,0.6606
RT she's thinking about how she's going to die because your husband doesn't believe in climate change,,,NEG,0.8725
RT HRC proposes installing half a billion solar panels by the end of her first term. Trump thinks climate change is a hoaxÃ â Â,,,NEU,0.6152
RT LIAR! THERE IS NOT TREMENDOUS DISAGREEMENT! Scott Pruitt denies that carbon dioxide causes global warming,,,NEG,0.8136
"RT Even if climate change was a hoax , why wouldn t you want to reduce pollution and improve the planet you live on regardless?",,,NEU,0.5291
"RT They also think President Obama is Muslim, Black Lives Matter are terrorists, amp climate change isn't real.",,,NEG,0.8874
"climate change denier is the term to use. I can ask whether or not you believe card exist. If you deny it, I'll call you",,,NEG,0.7138
Too bad there is no evidence for global warming.,,,NEG,0.8157
Hard to believe a species brilliant enough to accomplish this can behave so ignorantly regarding issues like climate change.,,,NEG,0.8462
"RT Irony Florida, a state in danger of being washed away due to rising sea levels, just elected a guy who denies climate changeÃ â Â",,,NEG,0.8146
US govt agency manipulated data to exaggerate climate change whistleblower,,,NEG,0.5017
RT VOTE VOTE VOTE!!!! VOTING for a candidate that believes climate change is a hoax is theÃ â Â,,,NEG,0.8086
RT Surprise! Trump wants a coal booster and climate change denier to head the Interior Department. via,,,NEG,0.7243
RT Here we go...still waffling on abt damn climate change policy BS..it is a f cking scam full stop!!,,,NEG,0.9484
RT Look at all the climate change deniers vying for jobs in the Trump administration,,,NEG,0.5866
RT We have a president elect who doesnÃ â â t believe in climate change. ThatÃ â â s frightening for this country and the world.,,,NEG,0.8961
RT EPA head Scott Pruitt said he doesn t believe carbon dioxide is a main contributor to global warming,,,NEU,0.7418
RT We have a president elect who doesn't believe in climate change. Millions of people are going to have to say Mr. TÃ â Â,,,NEG,0.8839
"trump removes climate change info from website. I guess the moron thinks if it isn't there, it doesn't exist. So sad, no brain!!!",,,NEG,0.8641
"Because it's not news, it's waffle. Concentrate on the TPP, climate change denying, etc, etc. That's the important shit!",,,NEG,0.7451
RT More oil is nothing to celebrate if you're anything other than an all out climate change denier. We can't burn it.,,,NEG,0.8715
RT Only deniers are ones saying all climate change is manmade.,,,NEG,0.6427
RT Just a reminder that Donald Trump thinks climate change is a hoax invented by the Chinese,,,NEG,0.5873
RT our president think climate change is a hoax made by the chinese amp our vice president thinks being gay is a curable disease.Ã â Â,,,NEG,0.7968
RT To everyone who believes that climate change is real...tweet to Pres. Elect. Trump and let your vo,,,NEU,0.8139
"RT It's supposed to be 60Ã Â and sunny today in Minnesota in November. But global warming isn't real, right?",,,NEU,0.6407
RT We have a president elect who doesnÃ â â t believe in climate change. ThatÃ â â s frightening for this country and the world.,,,NEG,0.8961
RT Trump s pick to lead the EPA is a climate change denier who s suing the EPA p2 ctl,,,NEG,0.7407
RT Just WHAT do these anti Trump protesters think he'll do a St Valentine's Day Massacre on climate change alarmists? CALM DOÃ â Â,,,NEG,0.8157
Donald Trump thinks climate change is a hoax... ...sigh.,,,NEG,0.8177
Republicans held a fake inquiry on climate change to attack the only credible scientist in the room The Verge,,,NEG,0.6923
"Your a fake, a fraud. Just like man made climate change. Top ex NOAA scientist has revealed he skewed wa",,,NEG,0.8702
RT she's thinking about how she's going to die because your husband doesn't believe in climate change,,,NEG,0.8725
"RT A climate change denier will head the EPA. Science, facts, and critical thinking are under assault.",,,NEG,0.8649
"If y'all watched Leo Dicaprio's movie 'Before The Flood' like I did, you'd remember that he still thinks climate change isn't real.",,,NEU,0.6717
RT It's almost 90 degrees outside on Halloween and some of y'all are still denying the legitimacy of global warming Ã Å Â â,,,NEG,0.772
Maybe Democratic nations need to start making it a crime to deny climate change and issuing warrants for the...,,,NEG,0.5104
"RT Climate alarmists believe in global warming, because they believe that other people believe in global warming. The intel",,,NEU,0.7139
RT We have a president elect who doesnÃ â â t believe in climate change. ThatÃ â â s frightening for this country and the world.,,,NEG,0.8961
RT HRC proposes installing half a billion solar panels by the end of her first term. Trump thinks climate change is a hoaxÃ â Â,,,NEU,0.6152
"RT Well done if you voted Green. You helped elect a President who doesn't believe in climate change, loves coal and wants toÃ â Â",,,POS,0.7806
Isn't it amazing how people actually think that climate change is fake. I guess the overwhelming evidence just isn't good enough for people,,,NEG,0.779
RT We have a president elect who doesn't believe in climate change. Millions of people are going to have to say Mr. TÃ â Â,,,NEG,0.8839
Here is another global warming hoax movie.,,,NEG,0.8036
RT 97 of scientists believe climate change is man made and causes rising sea levels of oceans. The other 3 believe Fra,,,NEU,0.8434
RT she's thinking about how she's going to die because your husband doesn't believe in climate change,,,NEG,0.8725
"RT Carbon is a major driver of global warming, and it will cost you ALL MONEY in the long run. Whether you believe or not.",,,NEG,0.8105
RT We have a president elect who doesn't believe in climate change. Millions of people are going to have to say Mr. TÃ â Â,,,NEG,0.8839
RT We have a president elect who doesn't believe in climate change. Millions of people are going to have to say Mr. TÃ â Â,,,NEG,0.8839
"RT Hey folks, never fear! is here to tell you that global warming is just AWESOME. Denier",,,POS,0.9621
RT Worried a presidential candidate thinks climate change is a hoax? You should ProbablyVote,,,NEG,0.8987
American Airlines can't fly planes because it's too hot while Perry denies humans are the cause for climate change.,,,NEG,0.8399
RT Sea ice melting away as Trump appoints infamous climate change denier and all purpose incompetent Scott Pruitt head,,,NEG,0.7931
"World food supplies at risk as climate change threatens international trade, warn experts",,,NEG,0.5405
RT A New report about Antarctica is horrible news for the global warming alarmists.,,,NEG,0.9091
I bet he believes in climate change too! Perhaps you could learn from him and make him one of your advisors!,,,NEU,0.5929
RT HRC proposes installing half a billion solar panels by the end of her first term. Trump thinks climate change is a hoaxÃ â Â,,,NEU,0.6152
RT TogetherWeCan spread the love and educate the people that climate change is not a hoax.,,,POS,0.6236
"RT Well done if you voted Green. You helped elect a President who doesn't believe in climate change, loves coal and wants toÃ â Â",,,POS,0.7806
RT The Coca Cola Polar Bear is a blatant promotion of climate change denial and heteronormative parenting.,,,NEG,0.8578
And they most of the GOP say global warming doesn't exist .bullshit. Every year in Ohio the seasons aren't much of a season,,,NEG,0.7808
RT We have a president elect who doesnÃ â â t believe in climate change. ThatÃ â â s frightening for this country and the world.,,,NEG,0.8961
RT The climate change mannequin challenge. 6 12 16. Glen Le Lievre.,,,NEU,0.9498
"RT If you don't believe in global warming, you don't believe in science and if you don't believe in science, how are you here",,,NEG,0.6805
Can't decide which is more horrifying the sexist abuse thrown at or the number of people who think climate change is a hoax.,,,NEG,0.9079
RT she's thinking about how she's going to die because your husband doesn't believe in climate change,,,NEG,0.8725
First day of November and the high was 88 degrees. Good thing climate change isn't real.,,,POS,0.3577
RT HRC proposes installing half a billion solar panels by the end of her first term. Trump thinks climate change is a hoaxÃ â Â,,,NEU,0.6152
"I don't believe global warming cooling can be affected by man, but SCIENCE is never vile, lying antisemitic",,,NEG,0.7699
RT The Whitehouse is being filled with creationist climate change deniers. But on the plus side God will give your grandchilÃ â Â,,,NEG,0.66
"Man made global warming, same as anthropogenic 'AGW'. gt 170 characters but factual despite GOPers denying.",,,NEU,0.6574
"RT In full page ad in NYT in 2009, called for urgent action on climate change. Which does he believe? httÃ â Â",,,NEU,0.8952
"aliens, terrorism, celebrity splits, earthquakes, climate change, recession, etc",,,NEG,0.7367
RT Honestly climate change scares the heck out of me and it makes me so sad to see what we're losing because of it.,,,NEG,0.9416
RT Conservs can keep pretending climate change is a hoax but other countries arent gonna be putting up with it anymore. htÃ â Â,,,NEG,0.837
RT Top environmental group calls for investigation of EPA head over climate change denial,,,NEU,0.7723
RT Denying the US's essential role in responding to climate change is another example of disregarding human life in favour of,,,NEG,0.8511
"When he hates the Trump administration, believes in equal rights, and is outraged by global warming",,,NEG,0.8852
"RT GOP, climate alarmists pushing costly global warming plan. Is Trump listening?",,,NEU,0.592
RT China is now explaining the history of climate change science politics 2 underscore to Trump they didnt do a hoax. GodÃ â Â,,,NEU,0.6913
you need to believe in climate change! Do it and you have my vote. If not it's going to,,,NEU,0.5068
RT 'Only 44 of Canadians believe that climate change is caused mostly by humans.'? WHAT,,,NEG,0.7131
"RT 'If you believe in science and that we have to act on climate change, then you have to vote!' Ã â â Hillary",,,NEU,0.7416
RT How do people chose to not believe in climate change,,,NEU,0.5404
"RT A little girl just asked about climate change 'Do you believe in science? Because I do' Paid by Soros, r",,,NEU,0.7769
RT From HIV to climate change how to spot denialists in action,,,NEU,0.6172
RT EPA head Scott Pruitt denies that carbon dioxide causes global warming,,,NEU,0.6227
"RT He's a self proclaimed racist, misogynist, climate change denier, homophobe amp fascist. But she's a woman. ElectionNight",,,NEG,0.8733
we are facing extreme difficulties with a president who doesn't believe in climate change,,,NEG,0.8324
RT HRC proposes installing half a billion solar panels by the end of her first term. Trump thinks climate change is a hoaxÃ â Â,,,NEU,0.6152
Well I can not speak to the origins of the global warming myth but it being man made is nonsense 100,,,NEG,0.741
"RT The Tories are officially propped up by anti gay, anti choice, terrorist sympathising climate change deniers. Never let th",,,NEG,0.9205
"RT Trump, who once called climate change a hoax by the Chinese, tells Michigan crowd 'I'm an environmentalist.'",,,NEU,0.7888
if global warming isnt real explain why goths ended up on the endangered species list,,,NEG,0.7687
RT she's thinking about how she's going to die because your husband doesn't believe in climate change,,,NEG,0.8725
RT World leaders duped by manipulated global warming data via,,,NEG,0.6711
RT China very kindly explains to Trump that it didnÃ â â t invent climate change as a hoax.,,,NEU,0.7133
"RT IVotedBecause I believe in equality, we need comprehensive immigration reform, I am pro choice and global warming IS real. Ã â Â",,,NEU,0.5291
"I'll start believing in global warming the day my feet, Michigan's polar icecaps, begin to feel again.",,,NEU,0.6067
RT We have a president elect who doesn't believe in climate change. Millions of people are going to have to say Mr. TÃ â Â,,,NEG,0.8839
You'd think that even climate change deniers could get behind this solely from an economic standpoint. A Paris pull,,,NEU,0.6
RT Rep. Lamar Smith took a quick break from healthcare negotiations to tell us climate change isn't real,,,NEU,0.6915
RT if you believe in climate change. lmao.,,,NEU,0.6788
they deny climate change to help oil companies breaking treaties putting that pipeline on Indian land they have gone far enough,,,NEG,0.7912
RT Pope sees climate change as a deadly serious issue that must be addressed. President calls it a 'hoax' a view reflect,,,NEG,0.5609
RT This is what happens when climate change deniers take over the government,,,NEG,0.7449
"RT IVotedBecause I believe in equality, we need comprehensive immigration reform, I am pro choice and global warming IS real. Ã â Â",,,NEU,0.5291
"RT Great to catch up with Sir . Talked Maldives, democracy, climate change, resilience of small islandÃ â Â",,,POS,0.953
"To all the global warming conspiracy theorists , lol.",,,NEG,0.4673
I can't believe people actually believe climate change isn't real. Wow. We do deserve to become extinct.,,,NEG,0.9085
undermining climate change AND evolution allows us to teach science as some 3rd rate belief system.,,,NEG,0.8097
RT Trump will be the only world leader to deny climate change,,,NEU,0.5699
RT Scientists want to give the atmosphere an antacid to relieve climate change via,,,NEU,0.8396
RT Honest question. Who is the DUP Education Secretary who denies climate change science,,,NEG,0.5613
RT Do an investigation to verify that the global warming leaders have created a HOAX focused on PROFIT,,,NEG,0.5647
RT Centrica has donated to US climate change denying thinktank,,,NEG,0.5948
RT VOTE VOTE VOTE!!!! VOTING for a candidate that believes climate change is a hoax is theÃ â Â,,,NEG,0.8086
subway guy told me climate change isn't real,,,NEG,0.5135
"RT If you donÃ â â t believe man made global warming is a a silly issue, give to the Natural Resources Defense Council",,,NEG,0.5932
RT We have a president elect who doesn't believe in climate change. Millions of people are going to have to say Mr. TÃ â Â,,,NEG,0.8839
it was 16 c in Canada last week. They do know their administration denies global warming and wants to kill the EPA?,,,NEG,0.8029
EPA faked biosludge safety data just like it faked global warming temperature data!,,,NEG,0.826
RT We have a president elect who doesn't believe in climate change. Millions of people are going to have to say Mr. TÃ â Â,,,NEG,0.8839
RT she's thinking about how she's going to die because your husband doesn't believe in climate change,,,NEG,0.8725
RT she's thinking about how she's going to die because your husband doesn't believe in climate change,,,NEG,0.8725
hi just here to remind everyone that climate change is real. please don't have political debate and say climate change doesn't exist.,,,NEU,0.6979
RT how do people in Florida vote for someone who doesn't believe in climate changeÃ Å Â â there whole shits about to be flooded inÃ â Â,,,NEG,0.9087
"RT Only an uneducated, moron would think climate change is not real and want to still rely on fossil fuels.",,,NEG,0.8878
Have fun enjoying your President who doesn't believe in climate change. Educate yourself because your children's lives depend on it Ã Å ËœÅ,,,NEU,0.3966
RT Only in America do we accept weather predictions from a groundhog but deny climate change evidence from scientists... yikes,,,NEG,0.8049
RT HRC proposes installing half a billion solar panels by the end of her first term. Trump thinks climate change is a hoaxÃ â Â,,,NEU,0.6152
RT And Trump is a climate change denier! Looks like his family have caused climate change by putting a great big hole,,,NEG,0.8901
"It is now up to all of us, just because the new government doesn't support free speech, LGBTQ rights or believe in global warming doesn't...",,,NEG,0.5658
RT Look at all the climate change deniers vying for jobs in the Trump administration via â Â,,,NEU,0.5849
RT she's thinking about how she's going to die because your husband doesn't believe in climate change,,,NEG,0.8725
RT Here's how to talk about climate change with a denier.,,,NEU,0.6325
RT . denies CO2 is a primary contributor to climate change. Listen to the science pollutingpruitt amp,,,NEG,0.6339
RT Arsenal are having their November crisis in January. Don't tell me climate change doesn't exist. BOUARS,,,NEG,0.5481
There is NO global warming. Another lie from the left and the globalists,,,NEG,0.6851
MUG Here are all 53 times Trump tweeted climate change is fake because it's cold outside via,,,NEU,0.6145
The Trump regime made you apologize for the truth? You going to start tweeting about how climate change is a hoax now too?,,,NEG,0.9109
"When you let fear in, evil will be along soon too in form of global warming, climate change, clean air amp energy, amp ocean 'acid' lies. waleg",,,NEG,0.8399
Haven't seen this one before. His other video 'Debunking 5 climate change myths' is terrible. Do you want me to respond?,,,NEG,0.9114
RT Obama admin officials may have mishandled scientific data to advance global warming alarmism.,,,NEG,0.7453
RT China tells Trump climate change isn't a hoax it invented,,,NEU,0.6436
I think I understand. Are you by any chance a white nationalist that believes global warming is a h,,,NEU,0.6465
RT she's thinking about how she's going to die because your husband doesn't believe in climate change,,,NEG,0.8725
RT More proof of liberal scam called 'global warming.' Climate change? Sure. Climate has ALWAYS changed!,,,NEG,0.6781
RT she's thinking about how she's going to die because your husband doesn't believe in climate change,,,NEG,0.8725
RT she's thinking about how she's going to die because your husband doesn't believe in climate change,,,NEG,0.8725
climate change isn't real,,,NEU,0.5458
"And here the lefties either deny what is going on, or blame it on the invasion of Iraq, and global warming.",,,NEG,0.8075
RT We have a president elect who doesn't believe in climate change. Millions of people are going to have to say Mr. TÃ â Â,,,NEG,0.8839
he would also say that global warming is not real and all this is created by Fake News lol...what an egg...,,,NEG,0.736
"RT I can only imagine that every climate change denier in the back of their mind is thinking, 'Oh shit, what if this affects my h",,,NEG,0.8078
RT EPA head Scott Pruitt denies that carbon dioxide causes global warming,,,NEU,0.6227
RT Trump has called climate change a hoax. Now he has the chance to destroy efforts to beat it.,,,NEG,0.8586
RT HRC proposes installing half a billion solar panels by the end of her first term. Trump thinks climate change is a hoaxÃ â Â,,,NEU,0.6152
RT The same politicians who argue climate change is a hoax are enjoying a week of 70 degree weather in February.,,,NEG,0.6653
RT We have a president elect who doesn't believe in climate change. Millions of people are going to have to say Mr. TÃ â Â,,,NEG,0.8839
RT she's thinking about how she's going to die because your husband doesn't believe in climate change,,,NEG,0.8725
RememberWhenTrump said global warming is a myth created by China,,,NEG,0.5229
There's a tornado in michigan but people still don't believe in global warming,,,NEG,0.7454
"RT Damn girl, are you climate change because I believe you are real and that you might kill me",,,NEG,0.9237
RT Brad Trost Most Tories don't believe in human caused climate change,,,NEU,0.5796
RT Fascinating to see climate change deniers Bolt amp Sheridan so excited about Trump's win. So politics contradicts scienceÃ â Â,,,NEG,0.4733
From lowering oil price to climate change propaganda to renewable energy it is all about capital restructuringÃ â Â,,,NEG,0.6335
"RT 34 also thinks the earth is flat, global warming is a hoax and Obama made it illegal for 1st cousins to marry.",,,NEG,0.8608
"RT Potential Trump FP admin officials are militarists, pro torture, anti civil liberties, climate change deniers. It's 'changÃ â Â",,,NEG,0.8552
RT Bullied by global warming,,,NEG,0.6079
