text,date,evento,sentiment,score
Omg sometimes I hate being home bc I got in a fight with my dad earlier bc he tried saying global warming isn't real,,,NEG,0.9243
"RT Since Trump proposed the Solar Wall, the Democratic Party has started to systematically deny climate change they now s",,,NEG,0.7905
RT World leaders duped by manipulated global warming data via,,,NEG,0.6711
RT Tillerson for Secretary of State! What's next climate change deniers for EPA amp Energy? Oh wait....,,,NEU,0.7558
thats alarming for the climate change alarmists .... see what i did ? the worlds lungs were created to use up c02,,,NEG,0.7858
RT How long before climate change deniers and flat earthers take a stand against trees for causing allergies?,,,NEG,0.6025
RT she's thinking about how she's going to die because your husband doesn't believe in climate change,,,NEG,0.8725
Donald Trump repeatedly publicly stated he believes climate change is a myth invented by the Chinese. What 'side' dÃ â Â,,,NEG,0.6874
RT Trump calls global warming a Chinese hoax. Clinton emails.,,,NEG,0.6507
RT Only in America do we accept weather predictions from a groundhog yet refuse to believe in climate change from scienti,,,NEG,0.5637
RT We have a president elect who doesn't believe in climate change. Millions of people are going to have to say Mr. TÃ â Â,,,NEG,0.8839
RT CO2 levels in atmosphere hit new high as EPA head denies its role in climate change,,,NEU,0.5225
RT China is now explaining the history of climate change science politics 2 underscore to Trump they didnt do a hoax. GodÃ â Â,,,NEU,0.6913
RT Bernie Sanders 'What astounds me is that we now have a president elect who does not believe climate change is realÃ â Â,,,NEG,0.8333
RT Global warming data FAKED by gov't to fit climate change fictions ClimateHoax FakeNews,,,NEG,0.7772
' r u climate change Denier',,,NEU,0.7087
"RT While you're in those booths today keep in mind one thinks climate change is a hoax, the other acknowledges it's realityÃ â Â",,,NEU,0.6753
RT she's thinking about how she's going to die because your husband doesn't believe in climate change,,,NEG,0.8725
"Despite fact checking, zombie myths about climate change persist Poynter blog",,,NEU,0.5925
RT We have a president elect who doesn't believe in climate change. Millions of people are going to have to say Mr. TÃ â Â,,,NEG,0.8839
RT she's thinking about how she's going to die because your husband doesn't believe in climate change,,,NEG,0.8725
RT Think Trump is right and climate change is a hoax? It's time to have a serious discussion about this Ã â Â,,,NEG,0.7681
RT Gore amp his money making scam of global warming is now known as climate change. The 70s warned of coming ICE AGE. YE,,,NEG,0.703
"RT IVotedBecause I believe in equality, we need comprehensive immigration reform, I am pro choice and global warming IS real. Ã â Â",,,NEU,0.5291
RT We have a president elect who doesn't believe in climate change. Millions of people are going to have to say Mr. TÃ â Â,,,NEG,0.8839
"RT Why so many Americans don't 'believe' in evolution, climate change and vaccines",,,NEG,0.6415
Scott Pruitt may sound reasonable on TV but Trump s EPA nominee is essentially a climate change denier,,,NEG,0.6752
RT A5. Those who deny climate change. There is no debate. Denying climate change is like denying 2 2 4.,,,NEG,0.6676
RT Analysis Here s just how far Republican climate change beliefs are outside the global mainstream,,,NEU,0.6157
Do aliens exist Martians may have been wiped out by global warming on Mars mars,,,NEU,0.7726
I don't believe in fake global warming.,,,NEU,0.4949
RT yet you side with someone who denies the legitimacy of climate change,,,NEG,0.7954
RT she's thinking about how she's going to die because your husband doesn't believe in climate change,,,NEG,0.8725
I do not understand how people still don't believe in climate change,,,NEG,0.857
RT Other conspiracy theories not about Obama Vaccines cause autism 3 million illegal voters climate change a ho,,,NEG,0.8457
RT How a professional climate change denier discovered the lies and decided to fight for science by,,,NEG,0.5049
RT now the SWISS get it. global warming was a scam,,,NEG,0.7616
"RT IVotedBecause I believe in equality, we need comprehensive immigration reform, I am pro choice and global warming IS real. Ã â Â",,,NEU,0.5291
EPA chief clings to his own fantasy by denying overwhelming evidence on CO2 and climate change via r worldnews,,,NEG,0.5687
RT because you irresponsibly deny climate change and threaten the regulations that protect us and our plane,,,NEG,0.8836
my science teacher is a woke king he told us gender is fake and climate change is real,,,POS,0.6839
RT she's thinking about how she's going to die because your husband doesn't believe in climate change,,,NEG,0.8725
RT youre a dumbass if you dont believe in climate change. this shit is happening fast unless this generation does something ab,,,NEG,0.9137
RT she's thinking about how she's going to die because your husband doesn't believe in climate change,,,NEG,0.8725
RT We have a president elect who doesn't believe in climate change. Millions of people are going to have to say Mr. TÃ â Â,,,NEG,0.8839
"RT I guess CNN considers Gatlinburg to be fake news. You know if it was caused by 'climate change' and not an arsonist, th",,,NEG,0.7735
RT I think that denying climate change is a crime against humanity. And they should be held accountable in a World Court.,,,NEG,0.9244
RT Electing a fascist is terrible enough. But putting a climate change denier on the throne now literally threatens our surviÃ â Â,,,NEG,0.9385
lol im not saying I believe in that or that global warming is fake. Just saying other views,,,NEG,0.4921
RT TrumpÃ â â s election wonÃ â â t stop deceitful climate change propaganda,,,NEG,0.7824
How can people still deny climate change?,,,NEG,0.7532
So true but is a climate change denier. He is doing everything he said would to the environment.,,,NEG,0.7756
Man has no significant effect on climate! Hence the name change from global warming hoax to climate change hoax!,,,NEG,0.6206
RT Sanders I agree with 'overwhelming majority of scientists who believe that climate change is real' SandersTownHall,,,POS,0.6783
what does climate change have to with CIA ZERO just another piece of Corrupt News Network dishonest amp fake news.,,,NEG,0.8622
dude u think climate change is a chinese hoax. that's all you need to know about yourself,,,NEG,0.8864
People don't believe in global warming because it's more convenient for them to not take responsibility for their actionsÃ Å ËœÅ,,,NEG,0.5328
RT Judge orders Exxon to hand over documents related to climate change for probe into whether company lied to public,,,NEU,0.6502
Crazy for believing in the truths of climate change and the lasting repercussions?,,,NEG,0.6068
But what do they have to help repel fascists? Does bug spray work? Do solar panels work on climate change deniers?,,,NEG,0.6365
RT Conservs can keep pretending climate change is a hoax but other countries arent gonna be putting up with it anymore. htÃ â Â,,,NEG,0.837
some people are color blind Ã Å ËœÂ³Ã Å ËœÂ³ I believe in climate change btw,,,NEG,0.5606
Australia's military has been training for climate change impacts for years. Conservative politicians denying clima,,,NEG,0.5072
"if global warming doesn't exist, HOW AM I STILL ABLE TO WEAR A TANK TOP AND SHORTS WHEN ITS ABOUT TO BE DECEMBER ???!!?!!!!!?! !!? amp amp 3 929",,,NEG,0.7631
RT Man made global warming is still a myth even though they now call it climate change. Enlist gt,,,NEG,0.7475
RT I just wanted to post this and remind everyone that we are putting a climate change denier in the White House,,,NEG,0.6322
"When POTUS does not believe that climate change is real, it is very chilling. Pun intended..ParisAgreement",,,NEG,0.8628
OurWild can t wait while Washington denies climate change. Join the ClimateMarch April 29.,,,NEG,0.4989
RT Your MCM denies climate change despite empirical evidence,,,NEG,0.6653
630 of America's biggest companies are pleading with Trump to give up his climate change denial,,,NEU,0.6074
"Trumps head of epa, Mr pruit, doesn't believe in global warming so why is vw paying anything in damages in america,",,,NEG,0.7441
The global warming crowd are the same people who deny that an unborn baby is a human being so science and,,,NEG,0.674
"RT To be fair, has made a fortune pushing his global warming scam. Leo may be on to something.",,,NEU,0.6401
RT she's thinking about how she's going to die because your husband doesn't believe in climate change,,,NEG,0.8725
RT If you don't believe in climate change please unfollow me,,,NEG,0.8133
Glad more of the coast can be swallowed up by coastal flooding as we allow our environment to deteriorate further and deny climate change Ã Å â Æ,,,NEG,0.7737
RT Even is ripping into Trump's EPA chief for denying the basic science of climate change. Watch gt,,,NEG,0.6886
RT World leaders duped by manipulated global warming data,,,NEG,0.7451
pls don't tell my global warming isn't real when the high today is pushing 90 degrees Ã Å â Æ,,,NEG,0.6734
I did get duped into climate change denial twitter... never going to do that again!,,,NEG,0.8901
Australia PM.s adviser climate change is UN hoax to create new world order global warming NWO newworldorder,,,NEG,0.627
I just heard just now that Trump has named a climate change denier from Oklahoma as head of the EPA. Name is Scott Brewer,,,NEU,0.7245
RT Slipped into unrelated story AP labels Trump EPA choice Scott Pruitt a 'climate change denier',,,NEG,0.5172
"RT Stops Nat'l parks from informing on climate change,lies about the election. DT is a sick childish embarrassment destroying o",,,NEG,0.9187
RT China to Trump climate change is not a Chinese hoax Ã Å¾Â Ã Â ï,,,NEU,0.6988
The failing of renewables will boost the finite unrenewablies contribution effect on climate change bigly. Enjoy,,,NEU,0.4288
"RT However, since Trump tells us climate change is just a ChineseHoax I guess I don't have to worry LiarInChief",,,NEG,0.4669
"climate change deniers, young earth creationists madasaboxoffrogs",,,NEG,0.5878
RT We have a president elect who doesn't believe in climate change. Millions of people are going to have to say Mr. TÃ â Â,,,NEG,0.8839
I still have a hard time understanding that some people do not believe climate change is a thing,,,NEG,0.7502
RT We have a president elect who doesnÃ â â t believe in climate change. ThatÃ â â s frightening for this country and the world.,,,NEG,0.8961
RT she's thinking about how she's going to die because your husband doesn't believe in climate change,,,NEG,0.8725
RT China tells Trump climate change isn't a hoax it invented,,,NEU,0.6436
RT Dear climate alarmists. The sun is the driving force of climate change.always has be,,,NEU,0.7068
RT if global warming isn't real why did club penguin shut down,,,NEG,0.7297
"RT It's global warming that the Republicans think doesn't exist , yet they believe Jesus made blind men s",,,NEG,0.6803
RT People who think climate change science is a hoax out here screaming about biology defined sexes,,,NEG,0.7951
RT China is now explaining the history of climate change science politics 2 underscore to Trump they didnt do a hoax. GodÃ â Â,,,NEU,0.6913
RT That's his most palatable quality! He's a hunter pal of the Trumps who denies climate change is a glutton for oil d,,,NEG,0.4393
"RT IVotedBecause I believe in equality, we need comprehensive immigration reform, I am pro choice and global warming IS real. Ã â Â",,,NEU,0.5291
RT We have a president elect who doesn't believe in climate change. Millions of people are going to have to say Mr. TÃ â Â,,,NEG,0.8839
"RT LOL!! Hint if u don't get the joke, u should STFU about climate change being a 'hoax'. And take a damn physics",,,NEG,0.8765
"RT Majority of Alaskans believe climate change is happening, according to a Yale report. Check out the interactive map",,,NEU,0.8714
RT We have a president elect who doesn't believe in climate change. Millions of people are going to have to say Mr. TÃ â Â,,,NEG,0.8839
New head of the EPA is disputing climate change scientists over the cause of climate change. The head of the EPA Who denies climate change,,,NEG,0.5813
RT Donald Trump can deny global warming cities can't cityoftrump,,,NEG,0.648
RT Our president doesn't believe in global warming so we're all doomed regardless,,,NEG,0.8421
But global warming isn't real right? fools,,,NEG,0.6011
...it's ok don't worry says climate change is not real!,,,POS,0.4565
RT Global mean sea levels have risen 9cm in my children's lifetimes. But probably just some climate change conspiracy,,,NEU,0.4769
RT We have a president elect who doesn't believe in climate change. Millions of people are going to have to say Mr. TÃ â Â,,,NEG,0.8839
RT Great Barrier Reef is A OK says climate change denier as she manhandles coral Mashable,,,NEU,0.5114
RT she's thinking about how she's going to die because your husband doesn't believe in climate change,,,NEG,0.8725
"and even if climate change were a hoax, do we still want the pollution that an upsurge in coal will bring?",,,NEG,0.6962
RT Pro fox hunting amp death penalty Denies climate change Opposes gay marriage amp abortion Paul Nuttall Poundshop Trump htt,,,NEG,0.8135
I'm genuinely concerned that we let a man into office that doesn't believe in global warming and thinks it's a Chinese scam??????,,,NEG,0.9084
the earth is flat and climate change is not real and does not matter.,,,NEU,0.5586
"RT Deniers gonna deny, but new research puts the last nail in the coffin of the global warming pause .",,,NEG,0.5912
RT she's thinking about how she's going to die because your husband doesn't believe in climate change,,,NEG,0.8725
RT China is now explaining the history of climate change science politics 2 underscore to Trump they didnt do a hoax. GodÃ â Â,,,NEU,0.6913
RT Did really just compare believing in man made climate change to believing the earth is flat?,,,NEG,0.5443
"RT That's why global warming isn't real, it's just distracting us from the love of Christ kb",,,NEG,0.8064
RT What do scientists actually believe about climate change? ParisAgreement,,,NEU,0.844
China delegate hits back at Trump's climate change hoax claims CNN,,,NEG,0.5471
RT she's thinking about how she's going to die because your husband doesn't believe in climate change,,,NEG,0.8725
RT A climate change denier is now in charge of the . It s worth noting what employees there did to resist.,,,NEG,0.6108
climate change doesn't exist.,,,NEU,0.5555
RT if global warming isn't real why did club penguin shut down,,,NEG,0.7297
"RT IVotedBecause I believe in equality, we need comprehensive immigration reform, I am pro choice and global warming IS real. Ã â Â",,,NEU,0.5291
RT Here is the column Stephens wrote denying global warming. He should either retract it or NYT must rescind its offer.,,,NEG,0.7947
RT she's thinking about how she's going to die because your husband doesn't believe in climate change,,,NEG,0.8725
RT We have a president elect who doesn't believe in climate change. Millions of people are going to have to say Mr. TÃ â Â,,,NEG,0.8839
RT Hey its november and its 83 degrees. Continue to tell me that climate change is a myth pls,,,NEG,0.594
I'd look into . A lot of scientists estimate earth can't sustain 4 years of climate change denial. Scary shit,,,NEG,0.8113
"Whether or not you believe global warming is real, don't you think we should be taking better care of this beautiful planet we inhabit? Ã Å Â â",,,NEU,0.6074
RT Thing is climate change doesn t care wether you believe it or not. It s not a religion. It s going to happen. Nay.,,,NEU,0.5818
"Trump picked Scot Pruit as head of the ENVIRONMENTAL PROTECTION AGENCY this guy doesnt believe in climate change, our planet is fucked",,,NEG,0.9204
"I do not believe climate change is a hoax,' Pruitt said. news carbondioxide carbondioxide",,,NEU,0.6463
This climate change agenda is being sponsored by the very oil companies who they seek to harm cap and trade taxation scam,,,NEG,0.8463
RT Vatican believes humans contribute to climate change scofflaw exorcists whose pact with Satan raises global temps,,,NEG,0.7715
"RT cdnpoli Isn't the guy who used climate change fear mongering to devalue coal mines, then bought them?",,,NEG,0.6077
I cannot believe that in this day and age there are still people denying that climate change is a reality. BeforetheFlood,,,NEG,0.9079
RT 630 of America's biggest companies are pleading with Trump to give up his climate change denial,,,NEU,0.7274
What does Trump believe about climate change?,,,NEU,0.7939
RT A climate change denier leading the EPA? Finally. I say we can't let a little extinction stop economic progress!,,,NEG,0.4697
I don't think Rubio is gonna lose although I'm not afraid to say he doesn't have my vote. 2017 and still denying climate changeÃ Å â Å½,,,NEG,0.7138
"Beyond believers and deniers for Americans, climate change is complicated",,,NEU,0.6277
RT she's thinking about how she's going to die because your husband doesn't believe in climate change,,,NEG,0.8725
RT she's thinking about how she's going to die because your husband doesn't believe in climate change,,,NEG,0.8725
RT she's thinking about how she's going to die because your husband doesn't believe in climate change,,,NEG,0.8725
RT If God didn't want us to cause global warming He wouldn't have put all those fake dinosaurs in the ground to test our f,,,NEG,0.6902
"RT Climate change 'pause' does not exist, scientists show, in wounding blow for global warming denialists Independent",,,NEU,0.5377
RT We have a president elect who doesnÃ â â t believe in climate change. ThatÃ â â s frightening for this country and the world.,,,NEG,0.8961
RT she's thinking about how she's going to die because your husband doesn't believe in climate change,,,NEG,0.8725
"denying climate change, repealing national marriage equality, threatening to ban an entire religion from being here.",,,NEG,0.8703
Obamas fiddled global warming data Shamelessly Manipulated ClimateScam GreenScam TeaParty tcot PJNet,,,NEG,0.8315
RT Just like you cannot properly run the if you're a climate change denier who has a hard on for fossil fuels Ah,,,NEG,0.8265
You might mention that Hilary Clinton strongly endorses science and believes climate change is real.,,,NEU,0.7175
"RT Hey Florida, nice little Everglades you've got there. Thanks for voting for a climate change denier. See you in hurricaneÃ â Â",,,NEG,0.8421
RT presidents that believe in climate change gt gt gt gt,,,NEG,0.5658
RT We have a president elect who doesnÃ â â t believe in climate change. ThatÃ â â s frightening for this country and the world.,,,NEG,0.8961
RT Terrific. Now Trump has appointed a climate change denier to head up the US environmental protection body.,,,NEU,0.4797
RT I got over the fact that we elected Trump and then I remember that he thinks climate change is a Chinese conspiracy and I losÃ â Â,,,NEG,0.7582
RT liberals are so annoying... have fun working to fight climate change w a person who believes climate change is a mÃ â Â,,,NEG,0.9009
oh here comes the conservative who care about the environment when most of you don't believe in climate change,,,NEG,0.6352
The DUB genuinely say climate change isn't real hahahahahaha they are just Twitter conspiracy theorists,,,NEG,0.8125
RT The death of the climate change scam is just more icing on the cake.,,,NEG,0.8678
We need all hands on deck to fight those who deny climate change and profit from killing our future generations.,,,NEG,0.6118
I believe in climate change amp am extremely proud of youz for finding a way to get the word out. Please stay strong!!,,,POS,0.9488
RT Alt Right doesn't believe in climate change but has no problem believing in this. CoolPartyBro,,,NEG,0.505
But it's snowing for the first time in 37 years in the Sahara so climate change must be a hoax! sarcasm,,,NEU,0.4449
RT Tim Kaine is demolishing Tillerson over the fact that ExxonKnew amp lied about climate change. Rex refusing to answer ques,,,NEG,0.7213
and I'm worried marching Earth Day will activate people's partisan identity wrt to climate change and alienate some 2,,,NEG,0.6392
I knew if it warmed up that someone would pull that climate change shit... Not saying it doesn't exist but come on,,,NEG,0.8042
RT Trump has characterized climate change as Chinese hoax. But says NOAA will follow science which could mean col,,,NEU,0.5242
RT Most Australians Are happy with 18c Are happy with SSM Believe in climate change Want a royal commission into the banks,,,POS,0.6855
RT she's thinking about how she's going to die because your husband doesn't believe in climate change,,,NEG,0.8725
RT HRC proposes installing half a billion solar panels by the end of her first term. Trump thinks climate change is a hoaxÃ â Â,,,NEU,0.6152
"RT ok a climate change denier heading the EPA is AWFUL, but what's that shade of lip stain my dude",,,NEG,0.9121
RT she's thinking about how she's going to die because your husband doesn't believe in climate change,,,NEG,0.8725
RT Imagine how much better cleaner our world would be if people believed in global warming amp recycling as much as they beli,,,POS,0.6061
194 countries also support Paris Accord. Trump is the one major world leader denying climate change.,,,NEU,0.6653
"RT After previously calling it a 'hoax,' Trump said there's 'some connectivity' between climate change amp human activit",,,NEU,0.8762
"RT Carbon credits are a fake currency for a fake correlation of CO2 to fake global warming fears, just cost shifting a",,,NEG,0.8424
climate change is a hoax to line the pockets of the degenerates in Washington. Trump is draining the swamp! maga,,,NEG,0.7879
RT trump denying climate change is like cornelius fudge vehemently denying that voldemort had returned,,,NEG,0.5881
RT she's thinking about how she's going to die because your husband doesn't believe in climate change,,,NEG,0.8725
well thay say global climate change is not a thing..but who do you believe science or trump,,,NEU,0.538
"I currently don't believe Scott Pruitt, so we're even. Ironic that statement implies he does admit global warming",,,NEG,0.7114
"RT Just because you don't believe in climate change does not mean it doesn't exist. We need action, not denial.",,,NEG,0.5218
"RT Fun fact if elected, Donald Trump would be the only leader of any nation on earth who denies climate change.",,,NEU,0.6146
"RT 6. POTUS might tweet the sky is not blue, therefore the climate change scientists are only providing FAKE NEWS",,,NEG,0.693
RT Yes this is an official result. I used the same method climate change believers use to prove their,,,NEU,0.8623
A story of intimidation and censorship The great global warming swindle ClimateScam tcot PJNet,,,NEG,0.8251
RT VOTE VOTE VOTE!!!! VOTING for a candidate that believes climate change is a hoax is theÃ â Â,,,NEG,0.8086
"But hey, climate change is a hoax anyway so the world totally won't be devastated before the end of the century, guys. Right? RIGHT???",,,NEU,0.4445
RT The Whitehouse is being filled with creationist climate change deniers. But on the plus side God will give your grandchilÃ â Â,,,NEG,0.66
RT We have a president elect who doesnÃ â â t believe in climate change. ThatÃ â â s frightening for this country and the world.,,,NEG,0.8961
RT 'Trump can t deny climate change without a fight' via,,,NEU,0.6836
RT The House Science Committee claims scientists faked climate change data here's what you should know,,,NEG,0.5273
"RT Trump appointed climate change denier, Scott Pruitt, to the head of the . would not have done that.",,,NEG,0.7739
RT PSA to anyone who doesn't believe in climate change. Also a PSA to everyone else that does believe.,,,NEU,0.7072
RT If you don't believe in global warming u r a dumbass,,,NEG,0.8023
good job environmentalism is a sham and climate change is fake,,,NEG,0.8701
I hope u understand that a majority of Americans know climate change is real amp not a hoax! But your policies show u don't give a damn,,,NEG,0.8227
"RT Simple. I believe in climate change, a woman's right to choose, gun safety amp the wealthy paying their fair share. TÃ â Â",,,NEU,0.6426
"RT For China, climate change is no hoax it s a business and political opportunity",,,NEU,0.6483
Talking about how states are marking out the path of the eclipse next month. States that deny evolution and climate change. Yeah...,,,NEU,0.5649
RT raise your hand if you believe in climate change,,,NEU,0.8357
RT 'We believe climate change is one of the greatest threats facing Canadians and the world and it ... needs global so,,,NEG,0.7136
RT she's thinking about how she's going to die because your husband doesn't believe in climate change,,,NEG,0.8725
Global warming and climate change are not man made.,,,NEU,0.6389
RT Unbelievable that Club Penguin is shutting down yet people still deny the impact of climate change on our planet,,,NEG,0.8473
Trump picks climate change denier for EPA team,,,NEG,0.5905
RT Patagonia is a company that strongly believes in climate change so sorry frat boyz you better find a new sweater to wear,,,NEG,0.8007
"RT In full page ad in NYT in 2009, called for urgent action on climate change. Which does he believe? httÃ â Â",,,NEU,0.8952
Weather Channel video uses young kids to promote Ã â Ëœglobal warmingÃ â â fear mongering,,,NEG,0.7639
RT she's thinking about how she's going to die because your husband doesn't believe in climate change,,,NEG,0.8725
RT SAD!!! EPA head Scott Pruitt denies that carbon dioxide causes global warming,,,NEG,0.792
RT HRC proposes installing half a billion solar panels by the end of her first term. Trump thinks climate change is a hoaxÃ â Â,,,NEU,0.6152
Dumb guy I went to school with posted something about global warming being fake and people tore him apart,,,NEG,0.8937
