text,date,evento,sentiment,score
"RT It's 2016, and a racist, sexist, climate change denying bigot is leading in the polls. ElectionNight",,,NEG,0.9002
Worth a read whether you do or don't believe in climate change,,,NEU,0.745
RT Mike Pence doesn t believe in global warming or that smoking causes lung cancer.,,,NEG,0.6477
RT no offense but like how do you just not believe in global warming,,,NEG,0.7161
RT she's thinking about how she's going to die because your husband doesn't believe in climate change,,,NEG,0.8725
RT We have a president elect who doesn't believe in climate change. Millions of people are going to have to say Mr. TÃ â Â,,,NEG,0.8839
Calum tweets abt reunitingish w the cast sees replies begging him to come to their countries Calum goes back to rting climate change,,,NEU,0.82
RT Obama raises climate change. You better vote for candidates who believe in science. ObamaUNC,,,POS,0.5953
Denying climate change ignores basic science,,,NEG,0.5951
BGR China practically says Trump lied about climate change,,,NEG,0.5709
RT Trump's climate change denial could cost us 100 trillion,,,NEG,0.8647
"RT Win probability is bullshit man. I saw the NBA Finals and that's when I knew, global warming isn't real",,,NEG,0.8125
"RT World food supplies at risk as climate change threatens international trade, warn experts",,,NEG,0.6103
RT she's thinking about how she's going to die because your husband doesn't believe in climate change,,,NEG,0.8725
Trump doesn't believe in global warming and he's going to be the President of the United States of America.... fuck,,,NEG,0.915
"RT Irony Florida, a state in danger of being washed away due to rising sea levels, just elected a guy who denies climate changeÃ â Â",,,NEG,0.8146
But global warming is a hoax though.,,,NEG,0.5834
"RT China tells Trump that climate change isn't a hoax it invented via Lol, China schooling TÃ â Â",,,NEU,0.635
"RT Irony Florida, a state in danger of being washed away due to rising sea levels, just elected a guy who denies climate changeÃ â Â",,,NEG,0.8146
"If global warming doesn't exist, why is club penguin shutting down?",,,NEG,0.6625
RT We have a president elect who doesnÃ â â t believe in climate change. ThatÃ â â s frightening for this country and the world.,,,NEG,0.8961
RT HRC proposes installing half a billion solar panels by the end of her first term. Trump thinks climate change is a hoaxÃ â Â,,,NEU,0.6152
RT NOAA Report 2016 was 2nd hottest year in history. One more reason to fight climate change deniers in Trump Admin gt,,,NEU,0.5718
conservatives just love denying science huh? from climate change to believing that fertilization of an egg an automatic human life.,,,NEG,0.8351
RT she's thinking about how she's going to die because your husband doesn't believe in climate change,,,NEG,0.8725
So we have a director of EPA who is a climate change denier. No a coal lobbies to as deputy EPA Chief. Environment,,,NEG,0.7627
RT The Chinese just broke massive iceberg in Antarctica as part of their global warming hoax.,,,NEG,0.7558
RT If global warming isn't real why did club penguin shut down,,,NEG,0.7196
RT our president think climate change is a hoax made by the chinese amp our vice president thinks being gay is a curable disease.Ã â Â,,,NEG,0.7968
"RT Are we looking at an America that officially believes climate change is a hoax? Sorry, everybody else.",,,NEG,0.7801
RT Ten of the ugliest animals threatened by climate change,,,NEG,0.8859
RT We have a president elect who doesn't believe in climate change. Millions of people are going to have to say Mr. TÃ â Â,,,NEG,0.8839
RT she's thinking about how she's going to die because your husband doesn't believe in climate change,,,NEG,0.8725
RT HRC proposes installing half a billion solar panels by the end of her first term. Trump thinks climate change is a hoaxÃ â Â,,,NEU,0.6152
RT he is literally a climate change denier....RIP our planet,,,NEG,0.9287
"RT Imagine trying to convince yourself that global warming isn't real and instead a conspiracy. Wake up, before it's tÃ â Â",,,NEG,0.7964
"So he IS saying climate change is a hoax, and every major scientific organization is a in on it?",,,NEG,0.7508
"RT New global warming study is terrible news for alarmists, good news for plants, animals an...",,,NEG,0.6854
"If you don't believe in climate change, then look at the polar bears that are going extinct, because they have no land to live on.",,,NEG,0.8236
We don't have to hear anti vaccers climate change deniers ACA killers out. Stop using your stupidity to try and kil,,,NEG,0.8908
RT she's thinking about how she's going to die because your husband doesn't believe in climate change,,,NEG,0.8725
People who believe in climate change also generally refuse to say that trans isn't real out loud so... You're no better.,,,NEG,0.8392
"You're not going to get away with this, we are going to call you out every single time. All pages are gone inc. fake climate change",,,NEG,0.9143
"RT CNN panelists erupt over climate change CNN Video Time to call out lies of Trump, Koch Brothers, and Heritage.",,,NEU,0.602
"Was already out after climate change denial, but either of the above would do, which is my loss as well",,,NEG,0.8103
global warming is a hoax perpetrated by the chinese.,,,NEG,0.7409
"RT If you donÃ â â t believe man made global warming is a a silly issue, give to the Natural Resources Defense Council",,,NEG,0.5932
Followed closely by climate change deniers and Wall Street executives.,,,NEU,0.6032
"Agreed! Man made climate change is a man made hoax, innit?",,,NEG,0.7393
"RT Me to my 14 yo kid do you believe in climate change? Kid It's a scientific fact, so it doesn't matte",,,NEU,0.8429
RT she's thinking about how she's going to die because your husband doesn't believe in climate change,,,NEG,0.8725
RT Leading global warming deniers just told us what they want trump to do via,,,NEG,0.5558
RT Fed scientist cooked climate change books ahead of Obama presentation NoMoreSCAMS NoMoreDEMOCRATS DrainTheSwamp,,,NEG,0.6786
"RT With a denier in the White House, how do we deal with the global warming catastrophe that threatens 7.5 billion of us withÃ â Â",,,NEG,0.7684
RT The people who predicted parts of Manhattan would be underwater by 2008 due to climate change are concerned about 'fakeÃ â Â,,,NEG,0.6606
RT China tells Trump climate change isn't a hoax it invented,,,NEU,0.6436
RT China to Trump climate change is not a Chinese hoax Ã Å¾Â Ã Â ï,,,NEU,0.6988
RT she's thinking about how she's going to die because your husband doesn't believe in climate change,,,NEG,0.8725
climate change is fakenews,,,NEG,0.6646
RT Good news that is looking to ditch the Paris agreement and bust open the climate change myth maga stepfoÃ â Â,,,NEU,0.5047
RT People still don't believe in global warming what can we do especially with the president pulling out of the P,,,NEG,0.7716
RT AND this motherfucker doesn't believe in climate change i,,,NEG,0.9275
at least Obama isn't a Christian extremist who thinks global warming amp evolution are hoaxes.,,,NEG,0.6341
"RT Well on the plus side, climate change isn't real anymore.",,,NEU,0.477
RT she's thinking about how she's going to die because your husband doesn't believe in climate change,,,NEG,0.8725
"Conversation will go 'morning Arthur, cold out.' 'Yes mal, global warming obviously fake' 'Agreed Arthur, who's thi",,,NEU,0.6736
RT We have a president elect who doesnÃ â â t believe in climate change. ThatÃ â â s frightening for this country and the world.,,,NEG,0.8961
RT Climate change whistleblower alleges NOAA manipulated data to hide global warming 'pause',,,NEG,0.5066
RT I can't believe there are politicians who believe that climate change is fake. And these are the people working for ourÃ â Â,,,NEG,0.895
RT people who don't believe in global warming explain this,,,NEG,0.5292
RT It's 10Ã Â F so climate change is a lie! That's 1 data point! Like u met me amp concluded all men are white and speak EnglisÃ â Â,,,NEG,0.6801
RT The people who predicted parts of Manhattan would be underwater by 2008 due to climate change are concerned about 'fakeÃ â Â,,,NEG,0.6606
"RT In Chile, 'there is 'no space for climate denial because we see climate change threatening us in multiple shapes.' '",,,NEU,0.6451
RT So much denial. So bad for us all. Energy Department climate office bans use of phrase climate change,,,NEG,0.9222
mashable Trump named a climate change denier to lead the agency that fights global warming,,,NEG,0.6054
I'm just going to say that creationists that dont believe in global warming have never listened to Bill Nye,,,NEG,0.6421
i'm sorry but if you think climate change is a hoax you are a fucking moron lol,,,NEG,0.9494
RT Trump's EPA head says he does not believe carbon dioxide is the primary contributor to global warming,,,NEU,0.7315
97 per cent of climate scientists believe climate change is real...DonaldTrump thinks it's a Chinese hoax! Sad!,,,NEG,0.7824
RT We have a president elect who doesn't believe in climate change. Millions of people are going to have to say Mr. TÃ â Â,,,NEG,0.8839
"RT IVotedBecause I believe in equality, we need comprehensive immigration reform, I am pro choice and global warming IS real. Ã â Â",,,NEU,0.5291
"RT while they still deny climate change, our denial that they could put profit over planet and people",,,NEG,0.7173
RT The mourning stage is over. Now we fight. Putting a climate change denier as head of EPA is an act of war on our kids. StandUp,,,NEG,0.8677
"RT new york times new marquee hire denies climate change and previously wrote about 'the disease of the arab mind,' re",,,NEG,0.5197
You cannot come out right after a significant weather event and blindly blame it on climate change and still believe in science,,,NEG,0.6659
RT The almost 100 Democrat vote of the very young is caused by climate change scaremongering and indoctÃ â Â,,,NEG,0.8521
you got it all wrong. The person who called climate change a hoax is clearly the crazy one.,,,NEG,0.9136
RT We have a president elect who doesn't believe in climate change. Millions of people are going to have to say Mr. TÃ â Â,,,NEG,0.8839
"A man who created a fake college, okay. A man who has no political experience, okay. A man who says global warming is by the Chinese, okay.",,,NEG,0.878
RT At what point in ur evolution did big oil make u realize climate change was a hoax?,,,NEU,0.5391
RT now the majority of people in office believe that climate change isn't real. mother earth is mourning today,,,NEG,0.8831
"why are there people that deny the climate change? not that I'm mad or anything, I'm just genuinely curious",,,NEG,0.6405
"RT But, of course, global warming is liberal hoax.",,,NEG,0.7125
RT if global warming doesn't exist then why is club penguin shutting down,,,NEG,0.6146
RT The admin that puts a climate change denier in charge of the EPA puts a guy who can't download his own apps in char,,,NEG,0.8125
RT she's thinking about how she's going to die because your husband doesn't believe in climate change,,,NEG,0.8725
RT We have a president elect who doesn't believe in climate change. Millions of people are going to have to say Mr. TÃ â Â,,,NEG,0.8839
RT if global warming doesn't exist then why is club penguin shutting down,,,NEG,0.6146
"An old cartoon of mine, but just as relevant today, as climate change denier Scott Pruitt works to subvert the core",,,NEG,0.5144
RT The people who predicted parts of Manhattan would be underwater by 2008 due to climate change are concerned about 'fakeÃ â Â,,,NEG,0.6606
Grandma just said she doesn't believe in climate change lol,,,NEU,0.541
"Worth a watch and I believe it has sincere intentions, but came off preachy to me, someone who believes climate change...",,,POS,0.6009
RT she's thinking about how she's going to die because your husband doesn't believe in climate change,,,NEG,0.8725
The tomatoes are still fruiting and flowering in November. Mama's neighbour still thinks climate change is a lie.,,,NEU,0.5181
"RT True Not all Trump supporters are white supremacist loving racist xenophobic climate change denying sexist swamp bigots, juÃ â Â",,,NEG,0.7225
RT We have a president elect who doesnÃ â â t believe in climate change. ThatÃ â â s frightening for this country and the world.,,,NEG,0.8961
"Talk about it when you believe in something, especially climate change. Because we need to know that we aren't alon",,,NEU,0.7117
"RT White supremacy thrives on denial of facts. The same denial that says global warming is a hoax, that vaccines cause autism",,,NEG,0.8378
RT Donald Trump once backed urgent climate change initiatives. He doesn't believe anything he's doing.,,,NEG,0.6092
"Trump appointees on climate change Not fake, not a big deal either",,,NEU,0.6228
Didn't the president of the United States tell us that climate change was a Chinese hoax?,,,NEU,0.5317
now tell me that climate change isn't real,,,NEG,0.5717
US takes the world another step backwards. denying human impact on climate change ignorance or,,,NEG,0.8437
RT . Trump trade polices are 'the economic equivalent of denying climate change or being for creationism.',,,NEG,0.7316
"Denying climate change is real, but let's celebrate how we will overcome the power of Obamacare, another 20 million more",,,POS,0.6215
RT she's thinking about how she's going to die because your husband doesn't believe in climate change,,,NEG,0.8725
RT she's thinking about how she's going to die because your husband doesn't believe in climate change,,,NEG,0.8725
Someone tell Trump to watch The Day After Tomorrow. Maybe he'll start believing in climate change if we show him something on his wavelength,,,NEU,0.5684
"Dems come up will stupid bill regarding 'fake news'.How about issues such as climate change, healthcare reform, etc.",,,NEG,0.8827
"RT Hey Florida, nice little Everglades you've got there. Thanks for voting for a climate change denier. See you in hurricaneÃ â Â",,,NEG,0.8421
RT MothersMarch4Climate bc climate change is no hoax!,,,NEU,0.4852
RT Trump's put a climate change denier in charge of the EPA?,,,NEG,0.5553
"RT 'If you believe in science and that we have to act on climate change, then you have to vote!' Ã â â Hillary",,,NEU,0.7416
YAY! Only 1 thing concerns me. Please look more into climate change. Those boys who deny it get biÃ â Â,,,NEG,0.4552
Ten of the ugliest animals threatened by climate change,,,NEG,0.9038
"RT Fun fact if elected, Donald Trump would be the only leader of any nation on earth who denies climate change.",,,NEU,0.6146
RT it's really sad how some people still don't believe in climate change. the world is literally changing before your eyesÃ â Â,,,NEG,0.9122
NBC News Posts Trump dismissed man made global warming a 'hoax' during...,,,NEU,0.6455
RT Only in America do we accept weather predictions from a groundhog yet refuse to believe in climate change from scientists,,,NEG,0.5977
"I'm not trying to be rude, but do people that voted for Trump not believe in climate change? Honest question.",,,NEG,0.678
RT 2016 was the year that the United States elected a man who believes that global warming is a Chinese conspiracy,,,NEG,0.675
Come at me with 'climate change isn't real'.,,,NEU,0.4977
RT EPA head Scott Pruitt denies that carbon dioxide causes global warming,,,NEU,0.6227
"RT climate p2 RT With climate change deniers in charge, time for scientists to step up.",,,NEU,0.7195
RT Question Al Gore on climate change and he'll call you a 'denier' Climate Change Dispatch via,,,NEU,0.7021
RT A CNN host said we should all vote for Hillary because she believes in climate change. These countries make one tÃ â Â,,,NEG,0.5482
RT she's thinking about how she's going to die because your husband doesn't believe in climate change,,,NEG,0.8725
's dangerous climate change denial,,,NEG,0.7985
Malcolm Roberts on why he doesn't believe in climate change SBS,,,NEU,0.7005
RT but I thought climate change was a hoax manufactured by the Chinese?,,,NEG,0.5567
RT It's 60 degrees. InJanuary. Up north. And our President Elect doesn't believe in global warming,,,NEG,0.5189
RT Florida's dumb ass voted Trump now y'all gone be underwater because Republicans don't believe in climate change.,,,NEG,0.9159
Al Gore is a fraud and refuses to debate global warming,,,NEG,0.8478
Imagine actually not believing in climate change even China believes in climate change,,,NEG,0.6449
RT Because Canadians believe in science and climate change! WhyILoveCanada,,,POS,0.9085
Stewart Jackson retweets fellow moron and climate change denier Paul Joseph Watson,,,NEG,0.692
RT Heartbreaking images of climate change that should make even the biggest deniers feel somethingÃ â Â,,,NEG,0.8182
are you kidding?! You think climate change doesn't exist?! Where did you go to school???,,,NEG,0.8993
RT China tells Trump climate change is not a Chinese hoax,,,NEU,0.7745
"RT The Trump climate change hoax, is the biggest hoax on Earth. DT wants sanctions lifted on the 500B",,,NEG,0.8893
RT We have a president elect who doesn't believe in climate change. Millions of people are going to have to say Mr. TÃ â Â,,,NEG,0.8839
"I'm new to this climate change idea, can you in your own words list the facts so I can use them to battle the unbelievers",,,NEU,0.6878
RT China tells Trump climate change isn't a hoax it invented,,,NEU,0.6436
"Or if climate change in which I believe, make no mistake literature da",,,NEU,0.8026
"In the spirit of baru pulang liburan dr Bali, I urge every Indonesian who denies climate change to go there then google pics fr 10yrs ago",,,NEU,0.711
I don't understand Republicans reasoning for not believing in global warming. Did I miss the part of the Bible where it says fuck science?,,,NEG,0.8836
RT It's 60 in Chicago. Snowed in the UAE. And the Senate just confirmed a climate change denier to run the EPA.,,,NEG,0.602
RT China very kindly explains to Trump that it didnÃ â â t invent climate change as a hoax.,,,NEU,0.7133
our president elect thinks climate change isn't real too.,,,NEG,0.8049
Proof that the National Post is the last bastion of oil payed climate change deniers,,,NEG,0.7885
"RT World leaders duped by manipulated global warming data, top NOAA climate scientist says",,,NEG,0.72
RT your mcm thinks global warming is a myth,,,NEG,0.595
"RT Powerful article frm Everyone believes in global warming, they just dont realize it. Time to ActOnClimate",,,NEU,0.6137
China delegate hits back at Trump's climate change hoax claims,,,NEG,0.6481
RT We have a president elect who doesn't believe in climate change. Millions of people are going to have to say Mr. TÃ â Â,,,NEG,0.8839
"RT PresidentElectTrump doesn't even have to start a nuclear war to destroy humanity, his climate change denial policy wiÃ â Â",,,NEG,0.8217
RT Conservs can keep pretending climate change is a hoax but other countries arent gonna be putting up with it anymore. htÃ â Â,,,NEG,0.837
bbcqt Trump's denies climate change because it's 'not good for business'? The world will rue this businessman's ignorance,,,NEG,0.8739
Such a beautiful day out...in February lol...but global warming does not exist. JustSaying,,,POS,0.925
"RT Trump, who once called climate change a hoax by the Chinese, tells Michigan crowd 'I'm an environmentalist.'",,,NEU,0.7888
RT 92 degrees in November... da fuq?? But climate change isn't real... Ã Å Ëœâ,,,NEG,0.8209
"RT IVotedBecause I believe in equality, we need comprehensive immigration reform, I am pro choice and global warming IS real. Ã â Â",,,NEU,0.5291
CNN EPA head doubts popular climate change belief PaginaNuova TV,,,NEU,0.5938
"RT Are we looking at an America that officially believes climate change is a hoax? Sorry, everybody else.",,,NEG,0.7801
RT I can't undrstnd how pple can believe in invisible heaven but not believe in climate change. climatechange is scary.,,,NEG,0.8085
Republican Party's change from concern about global warming to calling it a hoax is a story abt big big big money,,,NEG,0.537
RT she's thinking about how she's going to die because your husband doesn't believe in climate change,,,NEG,0.8725
RT So this girl is basically saving our planet while people like Donald trump still don't believe in global warming,,,NEU,0.5137
"Just realized the person who told me 'I don't believe in global warming, but ' is the Trump supporter equivalent of 'I'm not a racist, but '",,,NEG,0.5855
Peru builds up wetland resilience to reinforce indigenous response to climate change,,,NEU,0.7389
"RT As a proud Wildroser, I believe climate change is a authentic threat to humanity and requires action from my fellow cons",,,NEU,0.5833
I guess global warming and sea rise came earlier than I thought now that Wichita is on the Atlantic Coast.,,,NEU,0.6723
"While Trump's team denies climate change, cities and states are fighting back.",,,NEG,0.5872
so you're down with him denying climate change is real amp wants to stop funding UN climate change efforts? makessense,,,NEG,0.701
"Does your dad really believe that climate change is a hoax, or can he be cwant to destroy the world climate",,,NEG,0.7783
RT First he asked for list of people who believe in climate change and women's rights. But now anti terrorism experts?,,,NEU,0.6757
RT she's thinking about how she's going to die because your husband doesn't believe in climate change,,,NEG,0.8725
RT Trump will be the only world leader to deny climate change,,,NEU,0.5699
RT HRC proposes installing half a billion solar panels by the end of her first term. Trump thinks climate change is a hoaxÃ â Â,,,NEU,0.6152
RT Any scientist out there Still want to defend climate change? Both hoax inventors have run... ok lets focus on pic,,,NEG,0.59
RT We must work to elect representatives who believe in climate change and are willing to act!,,,NEU,0.5596
RT Hey Trump I dare you go to Texas while people are suffering from Hurricane and tell them ur view climate change is a hoax,,,NEG,0.8967
RT Look at all the climate change deniers vying for jobs in the Trump administration,,,NEG,0.5866
"You may not agree with climate change Axel, but I believe you have some left leanings yourself",,,NEU,0.7773
"If global warming doesn't scare you and or you don't care about it, boo bye",,,NEG,0.7856
Tbh people who believe climate change isn't real are the ones that need free education the most,,,NEG,0.6859
Failure to act now to make our food systems more resilient to climate change will 'seriously compromise' food...,,,NEG,0.7983
RT So glad Gore and Trump could find some middle ground between 'global warming is real' and 'it's a Chinese hoax designed to des,,,NEU,0.4423
RT We have a president elect who doesnÃ â â t believe in climate change. ThatÃ â â s frightening for this country and the world.,,,NEG,0.8961
I'm jealous of the winter storm on the East Coast and sad about MN temps expected to be in the 40's today. Glad global warming isn't real.,,,NEG,0.8568
I wish I could be there. I'm listening to two vets talk about how climate change is a hoax but UFOs are real. I'm very amused,,,POS,0.849
A high of 74 today the first day of November yep global warming is fake,,,NEU,0.4875
"RT Please don't vote for the guy who doesn't believe in climate change, views women as objects and has an overall lack of jusÃ â Â",,,NEG,0.8876
RT she's thinking about how she's going to die because your husband doesn't believe in climate change,,,NEG,0.8725
"RT Hey , how good is it that climate change isn't real? Imagine how hot it would be otherwise.",,,POS,0.7243
"I'm hearing rumours that climate change is a lie, so I'm thinking of just throwing the cans out of the window instead",,,NEG,0.7689
Right wing media turn scientists' citation quibble into stories we were 'duped' by manipulated global warming data',,,NEG,0.5967
Does the president of the US still not believe in global warming? Just curious,,,NEU,0.6372
RT Climatologists now believe global warming was dangerously accelerated by the Hall and Oates H2O album cover.,,,NEU,0.5084
Funding climate change is a scam.,,,NEG,0.8068
RT Trump's climate change denying EPA nominee Scott Pruitt cares more about the freedom to pollute than the freedom to,,,NEG,0.7935
"didn't even read it, going to assume it's about global warming climate alarmists are anti science, it has become a religion",,,NEG,0.7943
RT she's thinking about how she's going to die because your husband doesn't believe in climate change,,,NEG,0.8725
RT New report about Antarctica is horrible news for global warming alarmists TheBlaze,,,NEG,0.9041
RT she's thinking about how she's going to die because your husband doesn't believe in climate change,,,NEG,0.8725
"Whistleblower admits scientists manipulated data, making global warming seem worse to help Obama",,,NEG,0.7769
RT I'd rather MarchforBabies than march for fake science of climate change.,,,NEG,0.8007
RT she's thinking about how she's going to die because your husband doesn't believe in climate change,,,NEG,0.8725
So you want to buy a home in a global warming zone. RonLieber explains how to assess the risk you re taking on.,,,NEU,0.8399
RT We have a president elect who doesnÃ â â t believe in climate change. ThatÃ â â s frightening for this country and the world.,,,NEG,0.8961
"RT If you donÃ â â t believe man made global warming is a a silly issue, give to the Natural Resources Defense Council",,,NEG,0.5932
Your mcm Monday is scared of horror films I'm scared of the world wide climate change,,,NEG,0.7768
RT America's new president doesn't believe in climate change and thinks women who have abortions should be punished. WelcomeÃ â Â,,,NEG,0.7454
The internet reacts to Scott Pruitt s ignorant denial that CO2 is driving climate change Fusion,,,NEG,0.6776
"RT Trump is making biggest bet any leader has ever made physics isn't real, and climate change can be safely ignored",,,NEU,0.4635
